{
  "task": "tts",
  "dataset": {
    "name": "internal_prompt_set",
    "version": "v1",
    "split": "eval",
    "source_url": "https://github.com/Musawer1214/pashto-language-resources"
  },
  "model": {
    "name": "facebook/mms-tts",
    "revision": "main",
    "source_url": "https://huggingface.co/facebook/mms-tts"
  },
  "metrics": {
    "mos": 3.7,
    "mcd": 5.2
  },
  "run": {
    "date_utc": "2026-02-14T00:00:00Z",
    "hardware": "CPU",
    "notes": "Small prompt set with manual listening review."
  },
  "reproducibility": {
    "normalization_policy": "docs/pashto_normalization_v0.1.md",
    "command": "TODO: replace with the exact TTS evaluation command used for this run.",
    "config_ref": "TODO: point to the committed config, prompt set, or run card used for this run."
  }
}

