{
  "task": "asr",
  "dataset": {
    "name": "google/fleurs",
    "version": "main",
    "split": "test_ps_af",
    "source_url": "https://huggingface.co/datasets/google/fleurs"
  },
  "model": {
    "name": "openai/whisper-large-v3",
    "revision": "main",
    "source_url": "https://huggingface.co/openai/whisper-large-v3"
  },
  "metrics": {
    "wer": 0.312,
    "cer": 0.159
  },
  "run": {
    "date_utc": "2026-02-14T00:00:00Z",
    "hardware": "1x NVIDIA GPU",
    "notes": "Baseline run with default decoding."
  },
  "reproducibility": {
    "normalization_policy": "docs/pashto_normalization_v0.1.md",
    "command": "TODO: replace with the exact ASR evaluation command used for this run.",
    "config_ref": "TODO: point to the committed config, notebook, or run card used for this run."
  }
}
